Pergunta	Opção Correta	Opção Errada 1	Opção Errada 2	Opção Errada 3	Justificação
Que tipo de transportador de glicose existe na membrana de um eritrócito?	Glut1	Glut2	Glut3	Glut4	
Quanto à recuperação do NAD+, qual das seguintes afirmações é verdadeira?	No shuttle do malato-aspartato, o aspartato sai da mitocôndria num antiporte com glutamato.	No shuttle do malato-aspartato, o alfa-cetoglutarato é transformado em aspartato por uma reação de trans-aminação.	No shuttle do glixerol-3-P, o rendimento é mais elevadado do que nos outros.	Acidose lática é uma condição associada normalmente à falta de lactato desidrogenase.	
Quanto à regulação da glicólise, a presença de ATP não é um inibidor de qual/quais enzimas?	Hexocinase	Fosfofrutocinase 1	Piruvato Cinase	É de todas elas.	
Qual das seguintes afirmações,  referentes à regulação da glicólise é falsa?	A frutose-2,6-bifosfato é regulada por duas enzimas, a fosfofrutocinase-2 e a frutose-2,6-bifosfatase.	A proteína cinase A depende de cAMP para a sua atuação.	Na presença de insulina, temos frutose-2,6-bifosfato a estimular a PFK1.	No fígado, a piruvato cinase encontra-se ativa na sua forma desfosforilada.	
O transporte de glicose para o interior dos enterócitos ocorre:	Através de simporte, com Na+ por um transportador chamado SGLT1.	Para trazer uma molécula de glicose para o interior do enterócito, utiliza-se 1 ATP.  	Na bomba de Na+/K+, ocorre a passagem de 3 K+ para o interior da célula, ao passo que 2 Na+ saem para o exterior.	As Tight Junctions bloqueiam a passagem do Na+ intersticial para o lúmen intestinal.	
A entrada de frutose nas células do enterócito é medeada por:	Transportador Glut5.	SGLT1, em simporte com sódio, como a glucose.	Difusão passiva.	Através de uma associação com a bomba de sódio potássio, num antiporte com K+.	